{
  "spec_version": "0.3.1",
  "system_id": "demo",
  "assessed_at": 130,
  "artifacts": [
    {
      "id": "purpose",
      "version": 1,
      "type": "A1",
      "subject": "demo",
      "payload": {
        "purpose": "Enable booking",
        "beneficiaries": [
          "users"
        ],
        "outcomes": [
          {
            "key": "completion",
            "variable": "rate",
            "op": ">=",
            "threshold": 0.9,
            "unit": "ratio"
          }
        ],
        "horizon": {
          "start": 0,
          "end": 1000
        },
        "authority_source": "approved-charter",
        "context": "demo environment"
      },
      "references": []
      ,"supersedes": null
    },
    {
      "id": "requirements",
      "version": 1,
      "type": "A2",
      "subject": "demo",
      "payload": {
        "purpose_ref": { "id": "purpose", "version": 1 },
        "requirements": [
          {
            "key": "correctness",
            "variable": "score",
            "op": ">=",
            "threshold": 0.95,
            "unit": "ratio"
          }
        ],
        "constraints": [
          "no double booking"
        ],
        "source_refs": [
          "approved-charter"
        ]
      },
      "references": [
        {
          "id": "purpose",
          "version": 1
        }
      ],
      "supersedes": null
    },
    {
      "id": "design",
      "version": 1,
      "type": "A3",
      "subject": "demo",
      "payload": {
        "requirements_refs": [{ "id": "requirements", "version": 1 }],
        "components": [
          "booking-api"
        ],
        "interfaces": [
          "POST /booking"
        ],
        "design_decisions": [
          "atomic reservation"
        ]
      },
      "references": [
        {
          "id": "requirements",
          "version": 1
        }
      ],
      "supersedes": null
    },
    {
      "id": "workgrant",
      "version": 1,
      "type": "A8",
      "subject": "demo",
      "payload": {
        "decision_kind": "engineering_authorization",
        "actor": "agent",
        "authorized_actor": "agent",
        "scope": "w1",
        "decision": "approved",
        "decided_at": 50,
        "basis_refs": [],
        "target_ref": null,
        "authority_source": "policy",
        "valid_until": 900
      },
      "references": []
      ,"supersedes": null
    },
    {
      "id": "work",
      "version": 1,
      "type": "A4",
      "subject": "demo",
      "payload": {
        "design_ref": { "id": "design", "version": 1 },
        "work_id": "w1",
        "instruction": "Implement booking API",
        "work_state": "authorized",
        "state_changed_at": 80,
        "assigned_actor": "agent",
        "authorization_ref": {
          "id": "workgrant",
          "version": 1
        },
        "execution_evidence_refs": []
      },
      "references": [
        {
          "id": "design",
          "version": 1
        },
        {
          "id": "workgrant",
          "version": 1
        }
      ],
      "supersedes": null
    },
    {
      "id": "prodgrant",
      "version": 1,
      "type": "A8",
      "subject": "demo",
      "payload": {
        "decision_kind": "production_authorization",
        "actor": "release-owner",
        "authorized_actor": null,
        "scope": "release-1",
        "decision": "approved",
        "decided_at": 90,
        "basis_refs": [],
        "target_ref": null,
        "authority_source": "policy",
        "valid_until": 900
      },
      "references": []
      ,"supersedes": null
    },
    {
      "id": "implementation",
      "version": 1,
      "type": "A5",
      "subject": "demo",
      "payload": {
        "design_ref": { "id": "design", "version": 1 },
        "source_revision": "commit-123",
        "build_digest": "sha256:abc",
        "configuration_digest": "sha256:def",
        "deployment": {
          "environment": "production",
          "release_id": "release-1",
          "deployed_at": 100,
          "production_authorization_ref": { "id": "prodgrant", "version": 1 }
        }
      },
      "references": [
        {
          "id": "design",
          "version": 1
        },
        {
          "id": "work",
          "version": 1
        },
        {
          "id": "prodgrant",
          "version": 1
        }
      ],
      "supersedes": null
    },
    {
      "id": "method",
      "version": 1,
      "type": "A6",
      "subject": "demo",
      "payload": {
        "criterion_ref": {
          "id": "requirements",
          "version": 1
        },
        "criterion_key": "correctness",
        "bindings": {
          "variable": "score",
          "measurement_key": "score",
          "measurement_unit": "ratio"
        },
        "minimum_sources": 1,
        "max_age": 500,
        "min_coverage": 0.8
      },
      "references": [
        {
          "id": "requirements",
          "version": 1
        }
      ],
      "supersedes": null
    },
    {
      "id": "observation",
      "version": 1,
      "type": "A7",
      "subject": "demo",
      "payload": {
        "target_ref": {
          "id": "implementation",
          "version": 1
        },
        "method_ref": {
          "id": "method",
          "version": 1
        },
        "measurements": {
          "score": 0.99
        },
        "measurement_units": { "score": "ratio" },
        "observed_at": 120,
        "source_ids": [
          "ci-run-1"
        ],
        "source_provenance": [
          "ci-run-1"
        ],
        "coverage": 0.95,
        "kind": "test"
      },
      "references": [
        {
          "id": "implementation",
          "version": 1
        },
        {
          "id": "method",
          "version": 1
        }
      ],
      "supersedes": null
    },
    {
      "id": "purpose-method",
      "version": 1,
      "type": "A6",
      "subject": "demo",
      "payload": {
        "criterion_ref": { "id": "purpose", "version": 1 },
        "criterion_key": "completion",
        "bindings": {
          "variable": "rate",
          "measurement_key": "completion_rate",
          "measurement_unit": "ratio"
        },
        "minimum_sources": 1,
        "max_age": 500,
        "min_coverage": 0.8
      },
      "references": [{ "id": "purpose", "version": 1 }],
      "supersedes": null
    },
    {
      "id": "purpose-observation",
      "version": 1,
      "type": "A7",
      "subject": "demo",
      "payload": {
        "target_ref": { "id": "implementation", "version": 1 },
        "method_ref": { "id": "purpose-method", "version": 1 },
        "measurements": { "completion_rate": 0.92 },
        "measurement_units": { "completion_rate": "ratio" },
        "observed_at": 125,
        "source_ids": ["runtime-sample-1"],
        "source_provenance": ["runtime-sample-1"],
        "coverage": 0.9,
        "kind": "runtime"
      },
      "references": [
        { "id": "implementation", "version": 1 },
        { "id": "purpose-method", "version": 1 }
      ],
      "supersedes": null
    }
  ]
}
